{
  "$schema": "https://json-schema.org/draft/2020-12/schema",
  "$id": "grok_drop.schema.json",
  "title": "Grok drop",
  "description": "data/raw/grok/YYYY-MM-DDTHH-MM.json (window end, UTC): one collection window of X activity per candidate. Send null for anything that can't be measured, never a guess.",
  "type": "object",
  "additionalProperties": false,
  "required": ["schema_version", "collected_at", "window", "query_method", "candidates"],
  "properties": {
    "schema_version": {
      "const": "1.0"
    },
    "collected_at": {
      "$ref": "#/$defs/timestamp"
    },
    "window": {
      "type": "object",
      "additionalProperties": false,
      "required": ["start", "end"],
      "properties": {
        "start": {
          "$ref": "#/$defs/timestamp"
        },
        "end": {
          "$ref": "#/$defs/timestamp"
        }
      }
    },
    "query_method": {
      "type": "string",
      "minLength": 1
    },
    "candidates": {
      "type": "array",
      "items": {
        "type": "object",
        "additionalProperties": false,
        "required": ["candidate_id"],
        "properties": {
          "candidate_id": {
            "type": "string",
            "pattern": "^[a-z][a-z0-9_]*$"
          },
          "mentions": {
            "type": ["integer", "null"],
            "minimum": 0
          },
          "unique_authors": {
            "type": ["integer", "null"],
            "minimum": 0
          },
          "engagement": {
            "type": ["integer", "null"],
            "minimum": 0
          },
          "sentiment": {
            "type": ["object", "null"],
            "additionalProperties": false,
            "required": ["pos", "neg", "neu", "method"],
            "properties": {
              "pos": {
                "$ref": "#/$defs/fraction"
              },
              "neg": {
                "$ref": "#/$defs/fraction"
              },
              "neu": {
                "$ref": "#/$defs/fraction"
              },
              "method": {
                "type": "string"
              }
            },
            "description": "Old drops only: send null with stance, from which the pipeline derives the sentiment columns (pos = support, neg = oppose, neu = neutral, among relevant posts)."
          },
          "top_topics": {
            "type": ["array", "null"],
            "items": {
              "type": "string"
            }
          },
          "bot_share_estimate": {
            "oneOf": [
              {
                "$ref": "#/$defs/fraction"
              },
              {
                "type": "null"
              }
            ]
          },
          "sample_post_ids": {
            "type": ["array", "null"],
            "items": {
              "type": "string"
            },
            "description": "Not stored: the pipeline drops these before committing, so deleted posts never live in the public repository."
          },
          "query": {
            "type": ["string", "null"],
            "maxLength": 512,
            "description": "The X search query used for this candidate."
          },
          "mentions_method": {
            "enum": ["x_counts_endpoint", "native_count", "sample_estimate", null],
            "description": "How mentions was obtained: X's counts endpoint (complete), the agent's native X count, or an estimate from a sample."
          },
          "sample_size": {
            "type": ["integer", "null"],
            "minimum": 0,
            "description": "Posts read to compute sentiment, topics and the bot share. With stance, it equals stance.posts_drawn."
          },
          "stance": {
            "description": "Stance counts from routine 1's random sample (docs/x-stance-rubric.md). The four labels sum to posts_drawn; the pipeline computes the shares among relevant posts and their intervals. Needs rubric_version and sampling on the drop.",
            "oneOf": [
              {
                "$ref": "#/$defs/stance"
              },
              {
                "type": "null"
              }
            ]
          }
        }
      }
    },
    "rubric_version": {
      "type": "string",
      "pattern": "^stance-[1-9][0-9]*$",
      "description": "The version of docs/x-stance-rubric.md applied to the stance labels, e.g. stance-1."
    },
    "sampling": {
      "type": "object",
      "additionalProperties": false,
      "required": [
        "method",
        "posts_per_candidate",
        "read_all_below",
        "max_posts_per_author",
        "reposts_excluded",
        "automated_excluded",
        "relabel_share"
      ],
      "description": "How the posts behind stance were drawn.",
      "properties": {
        "method": {
          "const": "random_spread",
          "description": "Posts drawn at random across the whole window, not ranked by relevance or engagement."
        },
        "posts_per_candidate": {
          "type": "integer",
          "minimum": 1,
          "description": "Posts drawn for a candidate with at least read_all_below mentions."
        },
        "read_all_below": {
          "type": "integer",
          "minimum": 0,
          "description": "Below this many mentions, every eligible post is read."
        },
        "max_posts_per_author": {
          "type": "integer",
          "minimum": 1
        },
        "reposts_excluded": {
          "type": "boolean"
        },
        "automated_excluded": {
          "type": "boolean",
          "description": "Accounts that look automated are left out of the sample."
        },
        "relabel_share": {
          "$ref": "#/$defs/fraction",
          "description": "Share of the drawn posts labelled a second time, blind to the first labels."
        }
      }
    },
    "double_labels": {
      "type": "object",
      "additionalProperties": false,
      "required": ["posts", "counts"],
      "description": "The posts labelled twice, over every candidate of the drop: counts[first][second] is how many the first pass labelled <first> and the blind second pass labelled <second>. The pipeline computes Cohen's kappa from it.",
      "properties": {
        "posts": {
          "type": "integer",
          "minimum": 0,
          "description": "Posts labelled twice: the sum of every cell."
        },
        "counts": {
          "type": "object",
          "additionalProperties": false,
          "required": ["support", "oppose", "neutral", "off_topic"],
          "properties": {
            "support": {
              "$ref": "#/$defs/label_counts"
            },
            "oppose": {
              "$ref": "#/$defs/label_counts"
            },
            "neutral": {
              "$ref": "#/$defs/label_counts"
            },
            "off_topic": {
              "$ref": "#/$defs/label_counts"
            }
          }
        }
      }
    },
    "agent": {
      "type": "object",
      "additionalProperties": false,
      "required": ["name", "skill_version"],
      "description": "Optional: which agent and which version of its instructions produced the drop.",
      "properties": {
        "name": {
          "type": "string",
          "minLength": 1,
          "maxLength": 80
        },
        "skill_version": {
          "type": "string",
          "minLength": 1,
          "maxLength": 40
        },
        "run_id": {
          "description": "Optional: the routine run, e.g. x-activity-2026-10-16T06:20Z.",
          "type": "string",
          "pattern": "^[a-z0-9][a-z0-9-]*-\\d{4}-\\d{2}-\\d{2}T\\d{2}:\\d{2}Z$"
        }
      }
    }
  },
  "$defs": {
    "timestamp": {
      "type": "string",
      "pattern": "^\\d{4}-\\d{2}-\\d{2}T\\d{2}:\\d{2}:\\d{2}Z$"
    },
    "fraction": {
      "type": "number",
      "minimum": 0,
      "maximum": 1
    },
    "count": {
      "type": "integer",
      "minimum": 0
    },
    "stance": {
      "type": "object",
      "additionalProperties": false,
      "required": ["read_all", "posts_drawn", "off_topic", "support", "oppose", "neutral"],
      "properties": {
        "read_all": {
          "type": "boolean",
          "description": "true when the candidate had fewer than sampling.read_all_below mentions and every eligible post was read."
        },
        "posts_drawn": {
          "$ref": "#/$defs/count",
          "description": "Posts drawn and read, after the exclusions."
        },
        "off_topic": {
          "$ref": "#/$defs/count",
          "description": "Posts not about this candidate (another Le Pen, a namesake, a common word)."
        },
        "support": {
          "$ref": "#/$defs/count"
        },
        "oppose": {
          "$ref": "#/$defs/count"
        },
        "neutral": {
          "$ref": "#/$defs/count",
          "description": "About the candidate, with no stance: reporting, information, questions."
        }
      }
    },
    "label_counts": {
      "type": "object",
      "additionalProperties": false,
      "required": ["support", "oppose", "neutral", "off_topic"],
      "properties": {
        "support": {
          "$ref": "#/$defs/count"
        },
        "oppose": {
          "$ref": "#/$defs/count"
        },
        "neutral": {
          "$ref": "#/$defs/count"
        },
        "off_topic": {
          "$ref": "#/$defs/count"
        }
      }
    }
  },
  "dependentRequired": {
    "rubric_version": ["sampling"],
    "sampling": ["rubric_version"],
    "double_labels": ["rubric_version", "sampling"]
  }
}
