{
  "agent": {
    "name": "Grok Bot fr2027",
    "run_id": "x-activity-2026-10-26T00:42Z",
    "skill_version": "x-activity-3"
  },
  "candidates": [
    {
      "bot_share_estimate": 0.2857,
      "candidate_id": "arthaud",
      "engagement": null,
      "mentions": 162,
      "mentions_method": "x_counts_endpoint",
      "query": "(\"Nathalie Arthaud\" OR \"Arthaud\") lang:fr",
      "sample_size": 30,
      "sentiment": null,
      "stance": {
        "neutral": 16,
        "off_topic": 1,
        "oppose": 8,
        "posts_drawn": 30,
        "read_all": false,
        "support": 5
      },
      "top_topics": [
        "repeated presidential candidacies and low scores",
        "decent minimum wage demand",
        "media invitations after Trappes",
        "place of the far left versus LFI"
      ],
      "unique_authors": null
    },
    {
      "bot_share_estimate": 0.1053,
      "candidate_id": "kazib",
      "engagement": null,
      "mentions": 26,
      "mentions_method": "x_counts_endpoint",
      "query": "(\"Anasse Kazib\" OR \"Kazib\") lang:fr",
      "sample_size": 8,
      "sentiment": null,
      "stance": {
        "neutral": 3,
        "off_topic": 2,
        "oppose": 0,
        "posts_drawn": 8,
        "read_all": true,
        "support": 3
      },
      "top_topics": [
        "sponsorship signatures",
        "criticism of LFI",
        "far-left candidates in polls",
        "poll predictions"
      ],
      "unique_authors": null
    },
    {
      "bot_share_estimate": 1,
      "candidate_id": "labib",
      "engagement": null,
      "mentions": 7,
      "mentions_method": "x_counts_endpoint",
      "query": "(\"Selma Labib\") lang:fr",
      "sample_size": 0,
      "sentiment": null,
      "stance": {
        "neutral": 0,
        "off_topic": 0,
        "oppose": 0,
        "posts_drawn": 0,
        "read_all": true,
        "support": 0
      },
      "top_topics": null,
      "unique_authors": null
    },
    {
      "bot_share_estimate": 0.1752,
      "candidate_id": "melenchon",
      "engagement": null,
      "mentions": 32615,
      "mentions_method": "x_counts_endpoint",
      "query": "(\"Jean-Luc Mélenchon\" OR \"Mélenchon\") lang:fr",
      "sample_size": 200,
      "sentiment": null,
      "stance": {
        "neutral": 59,
        "off_topic": 0,
        "oppose": 102,
        "posts_drawn": 200,
        "read_all": false,
        "support": 39
      },
      "top_topics": [
        "property rights and housing requisition",
        "Trappes racist attack",
        "RN congress in Orléans",
        "TV and podcast interviews",
        "polls and second-round scenarios"
      ],
      "unique_authors": null
    },
    {
      "bot_share_estimate": 0.2147,
      "candidate_id": "glucksmann",
      "engagement": null,
      "mentions": 1687,
      "mentions_method": "x_counts_endpoint",
      "query": "(\"Raphaël Glucksmann\" OR \"Glucksmann\") lang:fr",
      "sample_size": 200,
      "sentiment": null,
      "stance": {
        "neutral": 91,
        "off_topic": 0,
        "oppose": 90,
        "posts_drawn": 200,
        "read_all": false,
        "support": 19
      },
      "top_topics": [
        "Mélenchon-Glucksmann rivalry on the left",
        "whether he is truly left-wing",
        "polls and third place",
        "absence from protests and Trappes rallies",
        "centre-right primary talk"
      ],
      "unique_authors": null
    },
    {
      "bot_share_estimate": 0.125,
      "candidate_id": "faure",
      "engagement": null,
      "mentions": 677,
      "mentions_method": "x_counts_endpoint",
      "query": "(\"Olivier Faure\") lang:fr",
      "sample_size": 88,
      "sentiment": null,
      "stance": {
        "neutral": 15,
        "off_topic": 2,
        "oppose": 68,
        "posts_drawn": 88,
        "read_all": false,
        "support": 3
      },
      "top_topics": [
        "Trappes racist attack and blame on the far right",
        "2024 dance controversy resurfaced",
        "alignment with LFI",
        "PS primary defeat and support for the winner",
        "anti-RN protest in Orléans"
      ],
      "unique_authors": null
    },
    {
      "bot_share_estimate": 0.2093,
      "candidate_id": "royal",
      "engagement": null,
      "mentions": 139,
      "mentions_method": "x_counts_endpoint",
      "query": "(\"Ségolène Royal\") lang:fr",
      "sample_size": 26,
      "sentiment": null,
      "stance": {
        "neutral": 18,
        "off_topic": 0,
        "oppose": 6,
        "posts_drawn": 26,
        "read_all": false,
        "support": 2
      },
      "top_topics": [
        "TV interviews on purchasing power",
        "criticism of CNews guests",
        "fact-checks of her claims",
        "dispute with a critic over Algeria"
      ],
      "unique_authors": null
    },
    {
      "bot_share_estimate": 0.136,
      "candidate_id": "guedj",
      "engagement": null,
      "mentions": 661,
      "mentions_method": "x_counts_endpoint",
      "query": "(\"Jérôme Guedj\" OR \"Guedj\") lang:fr",
      "sample_size": 106,
      "sentiment": null,
      "stance": {
        "neutral": 7,
        "off_topic": 1,
        "oppose": 86,
        "posts_drawn": 106,
        "read_all": false,
        "support": 12
      },
      "top_topics": [
        "street altercation with an intellectual",
        "antisemitism accusations",
        "whether he is still left-wing",
        "student protest at the RN congress",
        "Israel and Gaza"
      ],
      "unique_authors": null
    },
    {
      "bot_share_estimate": null,
      "candidate_id": "maurel",
      "engagement": null,
      "mentions": 0,
      "mentions_method": "x_counts_endpoint",
      "query": "(\"Emmanuel Maurel\") lang:fr",
      "sample_size": 0,
      "sentiment": null,
      "stance": {
        "neutral": 0,
        "off_topic": 0,
        "oppose": 0,
        "posts_drawn": 0,
        "read_all": true,
        "support": 0
      },
      "top_topics": null,
      "unique_authors": null
    },
    {
      "bot_share_estimate": 0.1323,
      "candidate_id": "hollande",
      "engagement": null,
      "mentions": 1025,
      "mentions_method": "x_counts_endpoint",
      "query": "(\"François Hollande\" OR \"Hollande\") lang:fr",
      "sample_size": 200,
      "sentiment": null,
      "stance": {
        "neutral": 91,
        "off_topic": 14,
        "oppose": 91,
        "posts_drawn": 200,
        "read_all": false,
        "support": 4
      },
      "top_topics": [
        "Hollande's record as president",
        "possible 2027 comeback",
        "Trappes shooting reactions",
        "left-wing and Socialist Party rivalry",
        "Macron's unpopularity"
      ],
      "unique_authors": null
    },
    {
      "bot_share_estimate": 0.2551,
      "candidate_id": "roussel",
      "engagement": null,
      "mentions": 278,
      "mentions_method": "x_counts_endpoint",
      "query": "(\"Fabien Roussel\" OR \"Roussel\") lang:fr",
      "sample_size": 72,
      "sentiment": null,
      "stance": {
        "neutral": 25,
        "off_topic": 12,
        "oppose": 26,
        "posts_drawn": 72,
        "read_all": false,
        "support": 9
      },
      "top_topics": [
        "Trappes racist shooting",
        "left unity and vote utile",
        "Orléans anti-RN protest",
        "communism and the PCF",
        "literary interview"
      ],
      "unique_authors": null
    },
    {
      "bot_share_estimate": 0.1135,
      "candidate_id": "tondelier",
      "engagement": null,
      "mentions": 1410,
      "mentions_method": "x_counts_endpoint",
      "query": "(\"Marine Tondelier\" OR \"Tondelier\") lang:fr",
      "sample_size": 121,
      "sentiment": null,
      "stance": {
        "neutral": 19,
        "off_topic": 2,
        "oppose": 90,
        "posts_drawn": 121,
        "read_all": false,
        "support": 10
      },
      "top_topics": [
        "Trappes shooting reactions",
        "antisemitism accusations",
        "RN congress in Orléans",
        "TV interview clash with a journalist",
        "Ipsos bva poll"
      ],
      "unique_authors": null
    },
    {
      "bot_share_estimate": 0.2125,
      "candidate_id": "ruffin",
      "engagement": null,
      "mentions": 164,
      "mentions_method": "x_counts_endpoint",
      "query": "(\"François Ruffin\" OR \"Ruffin\") lang:fr",
      "sample_size": 52,
      "sentiment": null,
      "stance": {
        "neutral": 23,
        "off_topic": 13,
        "oppose": 13,
        "posts_drawn": 52,
        "read_all": false,
        "support": 3
      },
      "top_topics": [
        "rivalry with LFI and Mélenchon",
        "his stance on anti-racism",
        "Grenoble mayor namesake controversy",
        "left-wing field after Trappes"
      ],
      "unique_authors": null
    },
    {
      "bot_share_estimate": 0.5385,
      "candidate_id": "bouamrane",
      "engagement": null,
      "mentions": 23,
      "mentions_method": "x_counts_endpoint",
      "query": "(\"Karim Bouamrane\" OR \"Bouamrane\") lang:fr",
      "sample_size": 6,
      "sentiment": null,
      "stance": {
        "neutral": 3,
        "off_topic": 1,
        "oppose": 2,
        "posts_drawn": 6,
        "read_all": true,
        "support": 0
      },
      "top_topics": [
        "social media videos mocked",
        "Ballon d'Or jokes",
        "Franco-Moroccan politicians"
      ],
      "unique_authors": null
    },
    {
      "bot_share_estimate": 0.3,
      "candidate_id": "cazeneuve",
      "engagement": null,
      "mentions": 58,
      "mentions_method": "x_counts_endpoint",
      "query": "(\"Bernard Cazeneuve\" OR \"Cazeneuve\") lang:fr",
      "sample_size": 14,
      "sentiment": null,
      "stance": {
        "neutral": 1,
        "off_topic": 11,
        "oppose": 2,
        "posts_drawn": 14,
        "read_all": true,
        "support": 0
      },
      "top_topics": [